{
  "title": "Finding Hope When Life Feels Impossible",
  "slug": "finding-hope-when-life-feels-impossible",
  "description": "A Christian reflection on finding hope in Jesus when life feels overwhelming and uncertain.",
  "category": "bible-faith",
  "date": "2026-09-08",
  "read_time": "5 min read",
  "dek": "When life feels impossible, God's presence reminds us that hope is never beyond reach.",
  "cover": {
    "src": "/images/articles/finding-hope-when-life-feels-impossible.jpg",
    "alt": "A peaceful sunrise representing hope and faith in God",
    "caption": "Hope can begin even in the darkest season."
  },
  "intro": [
    "Sometimes life becomes heavier than we expected.",
    "In those moments, Scripture reminds us that our hope is not based on circumstances, but on God."
  ],
  "sections": [
    {
      "heading": "God Is Near in Difficult Seasons",
      "paragraphs": [
        "When we feel overwhelmed, God does not move farther away.",
        "His presence remains with us even when we cannot see what comes next."
      ]
    },
    {
      "heading": "Hope Begins With Trust",
      "paragraphs": [
        "Faith does not mean that every problem disappears immediately.",
        "It means trusting God while we continue walking through uncertainty."
      ]
    }
  ],
  "images": [],
  "bible_verse": {
    "reference": "Psalm 34:18",
    "text": "The Lord is close to the brokenhearted and saves those who are crushed in spirit."
  },
  "closing": [
    "Whatever you are facing today, you do not have to face it alone.",
    "Keep trusting Jesus, one step at a time."
  ],
  "seo": {
    "title": "Finding Hope When Life Feels Impossible | Jaziel",
    "description": "Discover Christian encouragement and biblical hope when life feels impossible. Learn how faith in Jesus can help you keep moving forward.",
    "keywords": [
      "Christian hope",
      "hope in Jesus",
      "Bible encouragement",
      "Christian faith",
      "God's hope"
    ]
  },
  "og": {
    "title": "Finding Hope When Life Feels Impossible",
    "description": "When life feels impossible, discover the hope we can find in Jesus.",
    "image": "/images/articles/finding-hope-when-life-feels-impossible.jpg"
  },
  "tags": [
    "hope",
    "faith",
    "Jesus",
    "encouragement",
    "Bible"
  ],
  "related_articles": []
}
